{"classification":{"design_only":true,"exact_coordinate_materialization_available":false,"full_campaign_executed":false,"profile_join_kind":"strongest-defensible-bounded","reason":"The frozen known-universe census publishes aggregate profile bounds and an external canonical-ledger hash, but the exact expanded profile coordinate ledger is not present in this repository."},"compact_evidence_pack_v3":{"capacity_status":"PASS","conservative_hard_cap_overage_bytes":0,"conservative_soft_stop_overage_bytes":0,"forecast_cases":{"conservative":{"bytes_before_growth_allowances":5585880872,"bytes_by_evidence_class":{"canonical_inputs":18179912,"diagnostics":1656521032,"manifests_integrity":158336765,"performance_resource_samples":289050139,"physical_attempt_facts":280689390,"profile_environment_release_provenance":342356262,"semantic_results":2751787648,"shared_dictionary_cas":88959724},"class_a_requests":344916,"class_b_requests":344916,"diagnostic_growth_allowance_bytes":558588088,"fixed_targeted_and_general_reserve_bytes":1000000000,"hard_cap_delta_bytes":2547923157,"logical_executions":4007916898,"normal_list_requests":0,"object_count":344916,"performance_growth_allowance_bytes":279294044,"physical_attempts":4208312743,"qualification_corpus_bytes":28313839,"soft_stop_delta_bytes":547923157,"total_retained_bytes":7452076843},"expected":{"bytes_before_growth_allowances":2372287525,"bytes_by_evidence_class":{"canonical_inputs":7855062,"diagnostics":685064625,"manifests_integrity":68413151,"performance_resource_samples":119538492,"physical_attempt_facts":116080852,"profile_environment_release_provenance":147923135,"semantic_results":1188975051,"shared_dictionary_cas":38437157},"class_a_requests":149029,"class_b_requests":149029,"diagnostic_growth_allowance_bytes":94891501,"fixed_targeted_and_general_reserve_bytes":0,"hard_cap_delta_bytes":7480784259,"logical_executions":1731715455,"normal_list_requests":0,"object_count":149029,"performance_growth_allowance_bytes":23722876,"physical_attempts":1740374033,"qualification_corpus_bytes":28313839,"soft_stop_delta_bytes":5480784259,"total_retained_bytes":2519215741},"lower":{"bytes_before_growth_allowances":916217896,"bytes_by_evidence_class":{"canonical_inputs":3039628,"diagnostics":263776615,"manifests_integrity":26473442,"performance_resource_samples":46026984,"physical_attempt_facts":44695658,"profile_environment_release_provenance":57240961,"semantic_results":460090803,"shared_dictionary_cas":14873805},"class_a_requests":57669,"class_b_requests":57669,"diagnostic_growth_allowance_bytes":0,"fixed_targeted_and_general_reserve_bytes":0,"hard_cap_delta_bytes":9055468265,"logical_executions":670111919,"normal_list_requests":0,"object_count":57669,"performance_growth_allowance_bytes":0,"physical_attempts":670111919,"qualification_corpus_bytes":28313839,"soft_stop_delta_bytes":7055468265,"total_retained_bytes":944531735}},"hard_cap_bytes":10000000000,"measurement":{"bytes_by_evidence_class":{"canonical_inputs":4536,"diagnostics":400224,"manifests_integrity":39506,"performance_resource_samples":69836,"physical_attempt_facts":67816,"profile_environment_release_provenance":85420,"semantic_results":686588,"shared_dictionary_cas":22196},"bytes_per_logical_execution":"1.376122000","bytes_per_physical_attempt":"1.353451685","logical_executions":1000000,"physical_attempts":1016750,"retained_bytes":1376122},"qualification_corpus_bytes":28313839,"restored_baseline":{"conservative_hard_cap_overage_bytes":4559081529,"conservative_retained_bytes":14559081529,"conservative_soft_stop_overage_bytes":6559081529,"forecast_cases":{"conservative":{"bytes_before_growth_allowances":11765884947,"bytes_by_evidence_class":{"canonical_inputs":18179912,"diagnostics":7838773548,"manifests_integrity":156088324,"performance_resource_samples":289050139,"physical_attempt_facts":280689390,"profile_environment_release_provenance":342356262,"semantic_results":2751787648,"shared_dictionary_cas":88959724},"class_a_requests":344916,"class_b_requests":344916,"diagnostic_growth_allowance_bytes":1176588495,"fixed_targeted_and_general_reserve_bytes":1000000000,"hard_cap_delta_bytes":-4559081529,"logical_executions":4007916898,"normal_list_requests":0,"object_count":344916,"performance_growth_allowance_bytes":588294248,"physical_attempts":4208312743,"qualification_corpus_bytes":28313839,"soft_stop_delta_bytes":-6559081529,"total_retained_bytes":14559081529},"expected":{"bytes_before_growth_allowances":4928025194,"bytes_by_evidence_class":{"canonical_inputs":7855062,"diagnostics":3241773786,"manifests_integrity":67441659,"performance_resource_samples":119538492,"physical_attempt_facts":116080852,"profile_environment_release_provenance":147923135,"semantic_results":1188975051,"shared_dictionary_cas":38437157},"class_a_requests":149029,"class_b_requests":149029,"diagnostic_growth_allowance_bytes":197121008,"fixed_targeted_and_general_reserve_bytes":0,"hard_cap_delta_bytes":4797259707,"logical_executions":1731715455,"normal_list_requests":0,"object_count":149029,"performance_growth_allowance_bytes":49280252,"physical_attempts":1740374033,"qualification_corpus_bytes":28313839,"soft_stop_delta_bytes":2797259707,"total_retained_bytes":5202740293},"lower":{"bytes_before_growth_allowances":1900274763,"bytes_by_evidence_class":{"canonical_inputs":3039628,"diagnostics":1248209415,"manifests_integrity":26097509,"performance_resource_samples":46026984,"physical_attempt_facts":44695658,"profile_environment_release_provenance":57240961,"semantic_results":460090803,"shared_dictionary_cas":14873805},"class_a_requests":57669,"class_b_requests":57669,"diagnostic_growth_allowance_bytes":0,"fixed_targeted_and_general_reserve_bytes":0,"hard_cap_delta_bytes":8071411398,"logical_executions":670111919,"normal_list_requests":0,"object_count":57669,"performance_growth_allowance_bytes":0,"physical_attempts":670111919,"qualification_corpus_bytes":28313839,"soft_stop_delta_bytes":6071411398,"total_retained_bytes":1928588602}},"measurement":{"bytes_by_evidence_class":{"canonical_inputs":4536,"diagnostics":1893888,"manifests_integrity":38945,"performance_resource_samples":69836,"physical_attempt_facts":67816,"profile_environment_release_provenance":85420,"semantic_results":686588,"shared_dictionary_cas":22196},"logical_executions":1000000,"physical_attempts":1016750,"retained_bytes":2869225}},"retention_optimization":{"candidate_reductions":[{"candidate":"routine clean process diagnostic summary with ordered stdout commitment","conservative_retained_bytes":7452076843,"savings_bytes":7107004686,"scientific_effect":"No semantic coordinate or result is removed. Per-process routine stdout digest/length is omitted operational telemetry and the ordered set remains committed; every exception remains rich.","selected":true},{"candidate":"omit only reconstructible routine availability grids","conservative_retained_bytes":12966651733,"savings_bytes":1592429796,"scientific_effect":"No semantic loss, but insufficient: it remains above both capacity limits.","selected":false},{"candidate":"drop the complete performance/resource class","maximum_savings_bytes":332407660,"scientific_effect":"Insufficient alone and destroys performance/resource evidence.","selected":false},{"candidate":"drop the complete physical-attempt class","maximum_savings_bytes":322792799,"scientific_effect":"Insufficient alone and destroys retry, timestamp, interruption, and recovery evidence.","selected":false},{"candidate":"drop the complete semantic-result class","maximum_savings_bytes":3164555796,"scientific_effect":"Insufficient alone and prohibited because it removes match, capture, replacement, split, and error evidence.","selected":false},{"candidate":"remove qualification evidence and the complete fixed reserve","maximum_savings_bytes":1028313839,"scientific_effect":"Insufficient alone and violates qualification and targeted-expansion policy.","selected":false}],"conservative_byte_decomposition":[{"baseline_bytes":18179912,"evidence_class":"canonical_inputs","final_bytes":18179912,"ordinary_or_exceptional":"unchanged","savings_bytes":0,"tier":"A"},{"baseline_bytes":7838773548,"evidence_class":"diagnostics","final_bytes":1656521032,"ordinary_or_exceptional":"conditional: only routine clean process envelope fields are summarized","savings_bytes":6182252516,"tier":"C"},{"baseline_bytes":156088324,"evidence_class":"manifests_integrity","final_bytes":158336765,"ordinary_or_exceptional":"unchanged","savings_bytes":-2248441,"tier":"A"},{"baseline_bytes":289050139,"evidence_class":"performance_resource_samples","final_bytes":289050139,"ordinary_or_exceptional":"unchanged","savings_bytes":0,"tier":"B"},{"baseline_bytes":280689390,"evidence_class":"physical_attempt_facts","final_bytes":280689390,"ordinary_or_exceptional":"unchanged","savings_bytes":0,"tier":"A"},{"baseline_bytes":342356262,"evidence_class":"profile_environment_release_provenance","final_bytes":342356262,"ordinary_or_exceptional":"unchanged","savings_bytes":0,"tier":"A"},{"baseline_bytes":2751787648,"evidence_class":"semantic_results","final_bytes":2751787648,"ordinary_or_exceptional":"unchanged","savings_bytes":0,"tier":"A"},{"baseline_bytes":88959724,"evidence_class":"shared_dictionary_cas","final_bytes":88959724,"ordinary_or_exceptional":"unchanged","savings_bytes":0,"tier":"B"},{"baseline_bytes":1176588495,"evidence_class":"diagnostic_growth_allowance","final_bytes":558588088,"ordinary_or_exceptional":"unchanged 10% conservative rate applied to the modeled base","savings_bytes":618000407,"tier":"reserve"},{"baseline_bytes":588294248,"evidence_class":"performance_growth_allowance","final_bytes":279294044,"ordinary_or_exceptional":"unchanged 5% conservative rate applied to the modeled base","savings_bytes":309000204,"tier":"reserve"},{"baseline_bytes":1000000000,"evidence_class":"fixed_targeted_and_general_reserve","final_bytes":1000000000,"ordinary_or_exceptional":"unchanged","savings_bytes":0,"tier":"reserve"},{"baseline_bytes"